{
  "id": "6fba6aca-db12-4eb1-8ae6-918cf20e0f8c",
  "username": "Laura.Jennie.Reeves",
  "email": "Laura.Jennie.Reeves@mail.com",
  "first_name": "Laura",
  "last_name": "Jennie",
  "created_at": "2016-05-28T15:00:56.358Z",
  "updated_at": "2016-05-28T15:00:56.358Z",
  "profile": {
    "biography": "Ciao"
  }
}
